default,Identifier,Remarks,Filter,eng enc ena enz eni ens enj enb enl ent enw,cs,da,de,el,eo,es,esm esn esg esc esa esd esv eso esr ess esf esl esy esz esb ese esh esi esu,fi,fr,hu,it,jp,ko,nl,no nb,pl,pt,ptg,ro,ru,sr,tr
Do you really think you can handle that?\n\npress 'Y' or 'N'...,NIGHTMARE,,,,"Opravdu si myslíš, že to zvládneš?

Zmáčkni Y nebo N.","Tror du virkelig, at du kan klare det?

Tryk på Y eller N...","Bist du sicher, dass du das bewältigen kannst?

Drücke Y oder N.",,"Ĉu vi vere pensas, ke vi povas trakti tion?

Premu ""Y"" aŭ ""N""...","¿Realmente crees poder con eso?

Pulsa Y o N...",,Uskotko todella pystyväsi tähän?\n\nPaina 'Y' tai 'N'...,Vous pensez sérieusement que vous pourrez tenir le coup?\n\nAppuyez sur Y ou N...,Biztos vagy abban hogy megbírkózol vele?\n\nnyomj 'Y'-t vagy 'N'-t,"Pensi davvero di poterlo fare?

premere 'Y' o 'N'","ホントウニ タイショデキルト
オモッテイマスカ?

'Y'カ'N'デ オウトウセヨ","정말 이 난이도를 버틸 자신이 있으십니까?

Y키, 아니면 N키를 누르시오...","Denk je echt dat je dat aankunt? 

Druk op 'Y' of 'N'...",Tror du virkelig at du kan håndtere det? Trykk 'Y' eller 'N'...,"Czy ty naprawdę myślisz, że temu podołasz?

Wciśnij 'Y' lub 'N'...",Você acha que dá conta?\n\nAperte Y ou N...,,Chiar crezi că poți face față?\n\napasă 'Y' sau 'N'...,"Уверены, что справитесь?\n\nНажмите «Y» или «N»...",,Gerçekten bununla başa çıkabileceğini düşünüyor musun? 'Y' veya 'N' tuşuna basın...
Spot marked,AMSTR_MARKEDSPOT,,,,Bod označen,Pletmærket,Punkt markiert,,Punkto markita,Punto marcado,,Paikka merkitty,Repère marqué.,Hely megjelölve.,Posizione segnata,スポットヲ マーク シタ,마커 표시함,Vlek gemarkeerd,Punkt markert,Miejsce zaznaczone,Posição marcada,,Loc marcat,Отметка,Означено место,İşaretli nokta
Requires the GREEN keycard,PD_BLUEO,,,,Vyžaduje ZELENOU kartu,Kræver det GRØNNE nøglekort,Benötigt die GRÜNE Schlüsselkarte,,Vi bezonas la VERDAN ŝlosilkarton,Requiere la tarjeta llave VERDE,,Tarvitsee VIHREÄN avainkortin,Carte VERTE demandée.,ZÖLD kulcskártya szükséges,Richiede la card d'accesso VERDE,グリーン キーカード ガ ヒツヨウダ,필요함: 초록색 키카드,Vereist de GROENE sleutelkaart,Krever det GRØNNE nøkkelkortet,Wymaga ZIELONEJ karty,Você precisa do cartão de passe VERDE,,Necesită cardul VERDE,Требуется ЗЕЛЁНАЯ ключ-карта,,YEŞİL anahtar kartı gerektirir
Requires the PURPLE keycard,PD_REDO,,,,Vyžaduje FIALOVOU kartu,Kræver det LILLA nøglekort,Benötigt die VIOLETTE Schlüsselkarte,,Vi bezonas la PURPURAN ŝlosilkarton,Requiere la tarjeta llave VIOLETA,,Tarvitsee VIOLETIN avainkortin,Carte VIOLETTE demandée.,LILA kulcskártya szükséges,Richiede la card d'accesso VIOLA,イエロー キーカード ガ ヒツヨウダ,필요함: 보라색 키카드,Vereist de PAARSE sleutelkaart,Krever det LILLA nøkkelkortet,Wymaga FIOLETOWEJ karty,Você precisa do cartão de passe ROXO,,Necesită cardul MOV,Требуется ФИОЛЕТОВАЯ ключ-карта,,MOR anahtar kartı gerektirir
Requires the YELLOW keycard,PD_YELLOWO,,,,Vyžaduje ŽLUTOU kartu,Kræver det GULLE nøglekort,Benötigt die GELBE Schlüsselkarte,,Vi bezonas la FLAVAN ŝlosilkarton,Requiere la tarjeta llave AMARILLA,,Tarvitsee KELTAISEN avainkortin,Carte JAUNE demandée.,SÁRGA kulcskártya szükséges,Richiede la card d'accesso GIALLA,パープル キーカード ガ ヒツヨウダ,필요함: 노란색 키카드,Vereist de GELE sleutelkaart,Krever det GULT nøkkelkortet,Wymaga ŻÓŁTEJ karty,Você precisa do cartão de passe AMARELO,,Necesită cardul GALBEN,Требуется ЖЁЛТАЯ ключ-карта,,SARI anahtar kartı gerektirir
Requires the GREEN key,PD_BLUEK,,,,Vyžaduje ZELENÝ klíč,Kræver den GRØNNE nøgle,Benötigt den GRÜNEN Schlüssel,,Vi bezonas la VERDAN ŝlosilon,Requiere la llave VERDE,,Tarvitsee VIHREÄN avaimen,Clé VERTE demandée.,ZÖLD kulcs szükséges,Richiede la chiave VERDE,グリーン キー ガ ヒツヨウダ,필요함: 초록색 열쇠,Vereist de GROENE sleutel,Krever den GRØNNE nøkkelen,Wymaga ZIELONEGO klucza,Você precisa da chave VERDE,,Necesită cheia VERDE,Требуется ЗЕЛЁНЫЙ ключ,,YEŞİL tuş gerektirir
Requires the YELLOW key,PD_YELLOWK,,,,Vyžaduje ŽLUTÝ klíč,Kræver den GULLE nøgle,Benötigt den GELBEN Schlüssel,,Vi bezonas la PURPURAN ŝlosilon,Requiere la llave AMARILLA,,Tarvitsee KELTAISEN avaimen,Clé JAUNE demandée.,SÁRGA kulcs szükséges,Richiede la chiave GIALLO,イエロー キー ガ ヒツヨウダ,필요함: 노란색 열쇠,Vereist de GEELE sleutel,Krever den GUL nøkkelen,Wymaga ŻÓŁTEGO klucza,Você precisa da chave AMARELA,,Necesită cheia GALBENĂ,Требуется ЖЁЛТЫЙ ключ,,SARI tuş gerektirir
Requires the PURPLE key,PD_REDK,,,,Vyžaduje FIALOVÝ klíč,Kræver den LILLA nøgle,Benötigt den VIOLETTEN Schlüssel,,Vi bezonas la FLAVAN ŝlosilon,Requiere la llave VIOLETA,,Tarvitsee VIOLETIN avaimen,Clé VIOLETTE demandée.,LILA kulcs szükséges,Richiede la chiave VIOLA,パープル キー ガ ヒツヨウダ,필요함: 보라색 열쇠,Vereist de PAARSE sleutel,Krever den LILLA nøkkelen,Wymaga FIOLETOWEGO klucza,Você precisa da chave ROXA,,Necesită cheia MOV,Требуется ФИОЛЕТОВЫЙ ключ,,MOR tuş gerektirir
Picked up armor.,GOTARMOR,,,Picked up armour.,Sebráno brnění.,Hentede rustning.,Panzer genommen.,,Vi trovis armaĵon.,Encuentras una armadura.,Hallaste una armadura.,Panssari poimittu.,Armure récupérée.,Vért felvéve,Raccolto un'armatura.,アーマー ニュウシュ,획득: 전투복.,Je hebt een harnas opgehaald.,Plukket opp rustning.,Zebrano pancerz.,Pegou uma armadura.,,Ai ridicat Armura.,Получена броня.,Покупили сте панцир.,Zırhı aldım.
Picked up Combat Armor.,GOTMEGA,,,Picked up Combat Armour.,Sebráno bojové brnění.,Samlet Combat Armor op.,Super-Panzer genommen.,,Vi trovis batal-armaĵon.,Encuentras una armadura de combate.,Hallaste una armadura de combate.,Taistelupanssari poimittu.,Armure de combat récupérée.,Harci vért felvéve,Raccolto Armatura da combattimento.,コンバット アーマー ニュウシュ,획득: 강화된 전투복.,Je hebt een gevechtsharnas opgehaald.,Plukket opp kamprustning.,Zebrano pancerz bojowy.,Pegou uma Armadura de Combate.,,Ai ridicat Armura de Luptă.,Получена боевая броня.,,Savaş Zırhı aldı.
Superhealth,GOTMSPHERE,,,,Superzdraví,Superhealth,Super-Gesundheit,,Supersano,Supersalud,,Superterveys,Super-Santé,Szuperéleterő,Super salute,スーパー ヘルス,사용: 체력강화 버섯.,,Superhelse,Superzdrowie,Superssaúde,,Supersănătate,Суперздоровье,,Süper Sağlık
Obtained the GREEN keycard.,GOTBLUECARD,,,,Sebrána ZELENÁ karta.,Opnået det GRØNNE nøglekort.,GRÜNE Schlüsselkarte erhalten,,Vi trovis la VERDAN ŝlosilkarton.,Encuentras la tarjeta llave VERDE.,Hallaste la tarjeta llave VERDE.,VIHREÄ avainkortti poimittu.,Carte VERTE obtenue.,Megszerezted a ZÖLD kulcskártyát.,Ottenuta la card d'accesso VERDE.,グリーン キーカード ニュウシュ,획득: 초록색 키카드.,GROENE sleutelkaart ontvangen,Fått det GRØNNE nøkkelkortet.,Zdobyto ZIELONĄ kartę.,Pegou o cartão de passe VERDE.,,Ai achiziționat cardul VERDE.,Получена ЗЕЛЁНАЯ ключ-карта.,,YEŞİL anahtar kartı elde edildi.
Obtained the YELLOW keycard.,GOTYELWCARD,,,,Sebrána ŽLUTÁ karta.,Opnået det GULLE nøglekort.,GELBE Schlüsselkarte erhalten,,Vi trovis la FLAVAN ŝlosilkarton.,Encuentras la tarjeta llave AMARILLA.,Hallaste la tarjeta llave AMARILLA.,KELTAINEN avainkortti poimittu.,Carte JAUNE obtenue.,Megszerezted a SÁRGA kulcskártyát.,Ottenuta la card d'accesso GIALLA.,イエロー キーカード ニュウシュ,획득: 노란색 키카드.,GELE sleutelkaart ontvangen,Fått det GUL nøkkelkortet.,Zdobyto ŻÓŁTĄ kartę.,Pegou o cartão de passe AMARELO.,,Ai achiziționat cardul GALBEN.,Получена ЖЁЛТАЯ ключ-карта.,,SARI anahtar kartı elde edildi.
Obtained the PURPLE keycard.,GOTREDCARD,,,,Sebrána FIALOVÁ karta.,Opnået det LILLA nøglekort.,VIOLETTE Schlüsselkarte erhalten,,Vi trovis la PURPURAN ŝlosilkarton.,Encuentras la tarjeta llave VIOLETA.,Hallaste la tarjeta llave VIOLETA.,VIOLETTI avainkortti poimittu.,Carte VIOLETTE obtenue.,Megszerezted a LILA kulcskártyát.,Ottenuta la card d'accesso VIOLA.,パープル キーカード ニュウシュ,획득: 보라색 키카드.,PAARSE sleutelkaart ontvangen,Fikk det LILLA nøkkelkortet.,Zdobyto FIOLETOWĄ kartę.,Pegou o cartão de passe ROXO.,,Ai achiziționat cardul MOV.,Получена ФИОЛЕТОВАЯ ключ-карта.,,MOR anahtar kartı elde edildi.
Obtained the GREEN key.,GOTBLUESKUL,,,,Sebrán ZELENÝ klíč.,Opnået den GRØNNE nøgle.,GRÜNEN Schlüssel erhalten,,Vi trovis la VERDAN ŝlosilon.,Encuentras la llave VERDE.,Hallaste la llave VERDE.,VIHREÄ avain poimittu.,Clé VERTE obtenue.,Megszerezted a ZÖLD kulcsot.,Ottenuta la chiave VERDE.,グリーン キー ニュウシュ,획득: 초록색 열쇠.,GROENE sleutel ontvangen,Fikk den GRØNNE nøkkelen.,Zdobyto ZIELONY klucz.,Pegou a chave VERDE.,,Ai achiziționat cheia VERDE.,Получен ЗЕЛЁНЫЙ ключ.,,YEŞİL anahtar elde edildi.
Obtained the YELLOW key.,GOTYELWSKUL,,,,Sebrán ŽLUTÝ klíč.,Opnået den GULLE nøgle.,GELBEN Schlüssel erhalten,,Vi trovis la FLAVAN ŝlosilon.,Encuentras la llave AMARILLA.,Hallaste la llave AMARILLA.,KELTAINEN avain poimittu.,Clé JAUNE obtenue.,Megszerezted a SÁRGA kulcsot.,Ottenuta la chiave GIALLA.,イエロー キー ニュウシュ,획득: 노란색 열쇠.,GELE sleutel ontvangen,Fikk den GULA nøkkelen.,Zdobyto ŻÓŁTY klucz.,Pegou a chave AMARELA.,,Ai achiziționat cheia GALBENĂ.,Получен ЖЁЛТЫЙ ключ.,,SARI anahtar elde edildi.
Obtained the PURPLE key.,GOTREDSKUL,,,,Sebrán FIALOVÝ klíč.,Opnået den LILLA nøgle.,VIOLETTEN Schlüssel erhalten,,Vi trovis la PURPURAN ŝlosilon.,Encuentras la llave VIOLETA.,Hallaste la llave VIOLETA.,VIOLETTI avain poimittu.,Clé VIOLETTE obtenue.,Megszerezted a LILA kulcsot.,Ottenuta la chiave VIOLA.,パープル キー ニュウシュ,획득: 보라색 열쇠.,PAARSE sleutel ontvangen,Fikk den LILLA nøkkelen.,Zdobyto FIOLETOWY klucz.,Pegou a chave ROXA.,,Ai achiziționat cheia MOV.,Получен ФИОЛЕТОВЫЙ ключ.,,MOR anahtar elde edildi.
Healing mushroom,GOTSTIM,,,,Léčivka,Helbredende svamp,Heilpilz,,Saniga fungo,Seta medicinal,Hongo medicinal,Lääkesieni,Champignon médicinal,Gyógyító gomba,Funghi curativi,ヒーリング マッシュルーム,사용: 체력회복 버섯.,Genezende paddenstoel,Helbredende sopp,Leczący grzyb,Cogumelo medicinal,,Ciupercă vindecătoare,Целебный гриб,,İyileştirici mantar
Acquired: medical kit.,GOTMEDIKIT,,,,Získána lékárnička.,Erhvervet: medicinsk kit.,Erhalten: Medikit,,Vi trovis sukurkeston.,Encuentras un botiquín.,Hallaste un botiquín.,Saatu: lääkintälaukku.,Acquis: Kit médical.,Megszerezve: orvosi csomag,Acquisito: kit medico.,シュトク: メディカルキット,사용: 의료 키트.,Verworven: medische kit.,Ervervet: medisinsk sett.,Zdobyto: apteczkę.,Pegou um kit médico.,,Ridicat: Kit de Prim-Ajutor.,Получена: Аптечка.,,Elde edilen: tıbbi kit.
Acquired: medical kit that you REALLY need.,GOTMEDINEED,,,,"Získána lékárnička, kterou OPRAVDU potřebuješ.","Erhvervet: medicinsk kit, som du VIRKELIG har brug for.","Erhalten: Medikit, das du WIRKLICH brauchst",,"Vi trovis sukurkeston, kiun vi VERE bezonas.",Encuentras un botiquín que REALMENTE necesitabas.,Hallaste un botiquín que REALMENTE necesitabas.,"Saatu: lääkintälaukku, jota TODELLA tarvitsit.",Acquis: Kit médical. Besoin critique.,Megszerezve: már NAGYON hiányzott orvosi csomag,Acquisito: kit medico di cui VERAMENTE avete bisogno.,シュトク: キンキュウジタイヲ スクウ メディカルキット,사용: 당신을 살려줄 의료 키트.,Verworven: medische kit die je ECHT nodig heeft.,Ervervet: medisinsk sett som du virkelig trenger.,"Zdobyto: apteczkę, której NAPRAWDĘ potrzebujesz.",Pegou um kit médico que você REALMENTE precisa.,,Ridicat: Kit de Prim-Ajutor de care CHIAR AI nevoie.,Получена: Аптечка (КРАЙНЕ необходимая).,,Elde edilen: GERÇEKTEN ihtiyacınız olan tıbbi kit.
Map,GOTMAP,,,,Mapa,Kort,Karte,,Vi trovis la mapon,Mapa,,Kartta,Carte,Térkép,Mappa,コノ クイキノ マップダ ,획득: 지도.,Kaart,Kart,Mapa,Mapa,,Hartă,Карта,,Harita
Acquired: case of bullets.,GOTCLIPBOX,,,,Získána krabice nábojů.,Erhvervet: kasse med kugler.,Erhalten: Munitionskiste,,Vi trovis skatolon da kugloj.,Encuentras una caja de balas.,Hallaste una caja de balas.,Saatu: luotilaatikko.,Acquis: Boîte de balles.,Megszerezve: doboznyi lőszer.,Acquisito: caso di proiettili.,シュトク: バレット ケース,획득: 회전포 탄약.,Verworven: geval van kogels.,Ervervet: tilfelle av kuler.,Zdobyto: pudełko naboi.,Pegou uma caixa de balas,,Achiziționat: Cutie de gloanțe.,Получен: Ящик с пулями.,,Elde edilen: mermi kovanı.
Acquired: Grenade.,GOTROCKET,,,,Ziskán granát.,Erhvervet: Granat.,Erhalten: Granate,,Vi trovis grenadon.,Encuentras una granada.,Hallaste una granada.,Saatu: kranaatti.,Acquis: Grenade.,Megszerezve: Gránát.,Acquisito: Granata.,シュトク: グレネード,획득: 세열탄.,Verworven: Granaat.,Ervervet: Granat.,Zdobyto: Granat.,Pegou uma granada.,,Achiziționat: Grenadă.,Получена: Граната.,,Elde edildi: El bombası.
Acquired: Grenades.,GOTROCKBOX,,,,Ziskány granáty.,Erhvervet: Granater.,Erhalten: Granaten,,Vi trovis grenadojn.,Encuentras unas granadas.,Hallaste unas granadas.,Saatu: kranaatteja.,Acquis: Grenades.,Megszerezve: Gránátok.,Acquisito: Granate.,シュトク: グレネード セット,획득: 세열탄 여러 개.,Verworven: Granaten.,Ervervet: Granater.,Zdobyto: Granaty.,Pegou granadas.,,Achiziționat: Grenade.,Получены: Гранаты.,,Elde edildi: El bombaları.
Acquired: box of shotgun shells.,GOTSHELLBOX,,,,Získána krabice broků.,Erhvervet: kasse med haglpatroner.,Erhalten: Schrotpatronen,,Vi trovis skatolon da kartoĉoj.,Encuentras una caja de cartuchos de escopeta.,Hallaste una caja de cartuchos de escopeta.,Saatu: laatikollinen haulikon patruunoita.,Acquis: Boîte de cartouches.,Megszerezve: doboznyi puska sörét,Acquisito: scatola di cartucce per fucile.,シュトク: シェル ボックス,획득: 산탄총 탄약.,Verworven: doos met shotgun schelpen.,Ervervet: eske med haglepatroner.,Zdobyto: pudełko loftek do strzelby.,Pegou uma caixa de cartuchos de espingarda.,,Achiziționat: Cutie de muniție pentru pușcă.,Получена: Коробка патронов для дробовика.,,Edinildi: Bir kutu av tüfeği fişeği.
Acquired: ammo backpack.,GOTBACKPACK,,,,Ziskán batoh s municí.,Erhvervet: ammunitionsrygsæk.,Erhalten: Munitionsrucksack,,Vi trovis tornistron da municioj.,Encuentras una mochila de municiones.,Hallaste una mochila de municiones.,Saatu: ammusreppu.,Acquis: Sac de munitions.,Megszerezve: lőszeres hátizsák,Acquisito: zaino munizioni.,シュトク: バックパック,획득: 탄약 가방.,Verworven: munitie rugzak.,Ervervet: ryggsekk med ammunisjon.,Zdobyto: plecak z amunicją.,Pegou uma mochila de munição.,,Achiziționat: Raniță.,Получен: Ранец для боеприпасов.,,Edinildi: Cephane çantası.
Acquired: Grenade.,GOTBFG9000,,,,Získán granát.,Erhvervet: Granat.,Erhalten: Granate,,Vi trovis grenadon.,Encuentras una granada.,Hallaste una granada.,Saatu: kranaatti.,Acquis: Grenade.,Megszerezve: Gránát.,Acquisito: Granata.,シュトク: グレネード,획득: 세열탄.,Verworven: Granaat.,Ervervet: Granat.,Zdobyto: Granat.,Pegou uma granada.,,Achiziționat: Grenadă.,Получена: Граната.,,Elde edildi: El bombası.
Acquired: Minigun.,GOTCHAINGUN,,,,Získán kulomet.,Erhvervet: Minigun.,Erhalten: Minigun,,Vi trovis maŝinpafilon.,Encuentras una ametralladora.,Hallaste una ametralladora.,Saatu: minigun.,Acquis: Minigun.,Megszerezve: Gépfegyver.,Acquisito: Minigun.,シュトク: ミニガン,획득: 회전포.,Verworven: Minigun.,Ervervet: Minigun.,Zdobyto: Minigun.,Pegou uma metralhadora giratória.,,Achiziționat: Minimitralieră.,Получен: Пулемёт.,,Elde edildi: Minigun.
Acquired: Grenade launcher.,GOTLAUNCHER,,,,Získán granátomet.,Erhvervet: Granatkaster.,Erhalten: Granatwerfer,,Vi trovis grenadĵetilon.,Encuentras un lanzagranadas.,Hallaste un lanzagranadas.,Saatu: kranaatinheitin.,Acquis: Lance-Grenades,Megszerezve: Gránátvető,Acquisito: Lanciagranate.,シュトク: グレネードランチャー,획득: 세열탄 추진기.,Verworven: Granaatwerper.,Ervervet: Granatkaster.,Zdobyto: Wyrzutnię granatów.,Pegou um lança-granadas.,,Achiziționat: Lansator de grenade.,Получен: Гранатомёт.,,Elde edildi: El bombası fırlatıcı.
Entropy thrower!,GOTPLASMA,,,,Vrhač entropie!,Entropi-lancer!,Entropiewerfer,,Entropi-ĵetilon!,¡Lanzador de entropía!,,Entropianheitin!,Acquis: Lanceur d'Entropie!,Entrópiavető!,Lancia entropia!,エントロピースロワー!,획득: 엔트로피 방사기!,Entropiewerper!,Entropikaster!,Miotacz Entropii!,Lançador de entropia!,,Aruncător entropic!,Энтропиемёт!,,Entropi fırlatıcı!
Acquired: Shotgun.,GOTSHOTGUN,,,,Získána brokovnice.,Erhvervet: Shotgun.,Erhalten: Schrotflinte,,Vi trovis kartoĉan fusilon.,Encuentras una escopeta.,Hallaste una escopeta.,Saatu: haulikko.,Acquis: Fusil à pompe.,Megszerezve: Sörétes puska,Acquisito: Fucile.,シュトク: ショットガン,획득: 산탄총.,Verworven: Shotgun.,Ervervet: Haglgevær.,Zdobyto: Strzelbę.,Pegou uma espingarda.,,Achiziționat: Pușcă.,Получен: Дробовик.,,Edinildi: Av tüfeği.
God Mode ON,STSTR_DQDON,,,,Nesmrtelnost ZAP,Gud-tilstand PÅ,Gott-Modus AN,,Dio-Reĝimo AKTIVA,Modo Dios ACTIVADO,,Kuolemattomuustila PÄÄLLÄ,Mode invulnérable ON,Isten mód BE,Modalità Dio ATTIVATA,ゴッドモード オン,무적 치트: ON,God Modus AAN,Gudsmodus PÅ,Tryb Boga WŁĄCZONY,Modo Deus LIGADO,,Modul Invincibil PORNIT,Режим Бога ВКЛЮЧЁН,,Tanrı Modu AÇIK
God Mode OFF,STSTR_DQDOFF,,,,Nesmrtelnost VYP,Gud-tilstand  FRA,Gott-Modus AUS,,Dio-Reĝimo NEAKTIVA,Modo Dios DESACTIVADO,,Kuolemattomuustila POIS PÄÄLTÄ,Mode invulnérable OFF,Isten mód KI,Modalità Dio DISATTIVATA,ゴッドモード オフ,무적 치트: OFF,God Modus UIT,Gudsmodus AV,Tryb Boga WYŁĄCZONY,Modo Deus DESLIGADO,,Modul Invincibil OPRIT,Режим Бога ОТКЛЮЧЁН,,Tanrı Modu KAPALI
All weapons/ ammo/ keys,STSTR_KFAADDED,,,,Všechny zbraně/munice/klíče,Alle våben/ ammunition/ nøgler,"Alle Waffen, Munition und Schlüssel",,Ĉiuj armiloj/municioj/ŝlosiloj,Todas las armas/municiones/llaves,,Kaikki aseet/ ammukset/ avaimet,Toutes les armes/munitions/clés,Minden fegyver / lőszer / kulcs,Tutte le armi / munizioni / chiavi,スベテノ ブキ/カギ/ダンヤク,추가: 모든 무기/탄약/열쇠 치트,Alle wapens / munitie / sleutels,Alle våpen / ammunisjon / nøkler,Wszystkie bronie/amunicja/klucze,Todas as armas/munição/chaves,,Toate armele/muniție/chei,Всё оружие/боеприпасы/ключи,,Tüm silahlar/ cephane/ anahtarlar
All weapons and ammo,STSTR_FAADDED,,,,Všechny zbraně a munice,Alle våben og ammunition,Alle Waffen und Munition,,Ĉiuj armiloj kaj municioj,Todas las armas y municiones,,Kaikki aseet ja ammukset,Toutes les armes et munitions,Minden fegyver és lőszer,Tutte le armi e le munizioni,スベテノ ブキ/ダンヤク,추가: 모든 무기/탄약 치트,Alle wapens en munitie,Alle våpen og ammunisjon,Wszystkie bronie i amunicja,Todas as armas e munição completa,,Toate armele și muniție,Всё оружие и боеприпасы,,Tüm silahlar ve cephane
Abduction,TXT_HARMMAP01,,,,Únos,Bortførelse,Entführung,,Forkapto,Abducción,,Sieppaus,Enlèvement,Elrablás,Il rapimento,アブダクション,유괴,Ontvoering,Bortføring,Porwanie,Sequestro,,Răpire,Похищение,,Kaçırılma
Harm's Way,TXT_HARMMAP02,,,,Nebezpečí,,In Gefahr,,Vojo de danĝero,En peligro,,Vaara,Mise en Danger,Baj,La via del danno,ハーム'ズ ウェイ,해함의 길,,,Niebezpieczeństwo,No Caminho do Perigo,,Calea pericolului,Опасный путь,,Zarar Görebilecek Durumda
Owt Mood,TXT_HARMMAP03,,,,Špatný pocit,,Missstimmung,,Sentaĉo,Buen humor,,Nollatunnelma,Scontento,Túlterhelve,Scontento,ヤバイムード,이상한 분위기,,,Paskudny Nastrój,Mau Humor,,Fricțiune,Нестроение,,Kötü Ruh Hali
Megalapolis,TXT_HARMMAP04,,,,Megalopole,,Megalopolis,,Megtropolo,Megalópolis,,Megalopoli,Mégalopole,Megalopolisz,Megalapoli,メガラポリス,거대 도시,Megalopolis,,Megalapolis,Megalópole,,Megalopolis,Мегалаполис,,Megalapolis
The Hospital,TXT_HARMMAP05,,,,Nemocnice,Hospitalet,Das Hospital,,La malsanulejo,El hospital,,Sairaala,L'Hôpital,Kórház,L'ospedale,ホスピタル,병동,Het ziekenhuis,Sykehuset,Szpital,O Hospital,,Spitalul,Больница,,Hastane
The Weapons Factory,TXT_HARMMAP06,,,,Továrna na zbraně,Våbenfabrikken,Die Waffenfabrik,,La armil-fabriko,La fábrica de armas,,Asetehdas,L'Usine d'Armes,Fegyvergyár,La fabbrica di armi,ウェポンファクトリー,무기 공장,De Wapenfabriek,Våpenfabrikken,Fabryka Broni,A Fábrica de Armamentos,,Fabrica de Arme,Оружейный завод,,Silah Fabrikası
The Underwater Lab,TXT_HARMMAP07,,,,Podvodní laboratoř,Undervandslaboratoriet,Das Unterwasserlabor,,La subakva labotorio,El laboratorio submarino,,Vedenalainen laboratorio,Le Laboratoire Sous-marin,Vízalatti labor,Il laboratorio subacqueo,アンダーウォーターラボ,해저 연구소,Het onderwaterlaboratorium,Undervannslaboratoriet,Podwodne Laboratorium,O Laboratório Submarino,,Laboratorul Subacvatic,Подводная лаборатория,,Sualtı Laboratuvarı
Airstrip One,TXT_HARMMAP08,,,,Přistávací dráha jedna,Landingsbane et,Flugplatz Eins,,Surteriĝejo numero unu,Pista de aterrizaje uno,,Kiitorata Yksi,Piste D'Atterrisage Un,1-es kifutó,Pista Uno,エアーシップ ワン,활주로 1호,Vliegveld Een,Flystripe én,Lądowisko Numer Jeden,Base Aérea Um,,Pista Unu,Взлётная полоса №1,,Birinci Pist
The Launch Base,TXT_HARMMAP09,,,,Vzletová základna,Affyringsbasen,Die Startbasis,,La lanĉbazo,La base de despegue,,Laukaisutukikohta,La Base de Lancement,Kilövő Állomás,La base di lancio,ランチャーベース,발진기지,De lanceerbasis,Utskytningsbasen,Baza Startowa,A Base de Lançamento,,Baza de Lansare,Пусковая площадка,,Fırlatma Üssü
The Radioactive Zone,TXT_HARMMAP10,,,,Radioaktivní zóna,Den radioaktive zone,Die radioaktive Zone,,La radioaktiva zono,La zona radioactiva,,Radioaktiivinen vyöhyke,La Zone Radioactive,Radioaktív Zóna,La zona radioattiva,ラディオアクティブ ゾーン,방사능 처리소,De Radioactieve Zone,Den radioaktive sonen,Radioaktywna Strefa,A Zona Radioativa,,Zona Radioactivă,Заражённая зона,,Radyoaktif Bölge
Echidna,TXT_HARMMAP11,,,,,,,,Ekidno,,,Nokkasiili,,Hangyászsün,,エキドナ,에키드나,,,,Equidna,,,Ехидна,,Echidna
